{
    "id": 7757,
    "title": "Hamza Najeeb: Courageously Looking for Answers",
    "slug": "hamza-najeeb-courageously-looking-for-answers",
    "url": "https://cfi.co/middleeast/2014/08/hamza-najeeb-courageously-looking-for-answers/",
    "author": "CFI.co Editorial",
    "published": "2014-08-06 11:44:36",
    "published_gmt": "2014-08-06 10:44:36",
    "modified_gmt": "2022-09-01 11:51:39",
    "categories": [
        "Middle East"
    ],
    "classification": {
        "content_class": "editorial_analysis",
        "editorial_lens": "constructive_positive_lens",
        "independence_status": "independent_editorial",
        "independence_basis": "retrospective_review_2026-08",
        "sponsor_disclosure": "none",
        "sponsor_name": "",
        "article_status": "published",
        "historical_status": "current_at_publication",
        "correction_status": "none",
        "archive_policy": "no_delete",
        "provenance_layer": "github_versioned",
        "wayback_status": "archived",
        "wayback_first_snapshot": "20190922231722",
        "wayback_snapshot_url": "http://web.archive.org/web/20190922231722/https://cfi.co/middleeast/2014/08/hamza-najeeb-courageously-looking-for-answers/",
        "license": "CFI-OAAL-1.0"
    },
    "excerpt": "",
    "content_html": "<p style=\"text-align: justify;\"><strong><img class=\"alignright  wp-image-7758\" src=\"https://cfi.co/wp-content/uploads/2014/08/hn.jpg\" alt=\"hn\" width=\"164\" height=\"175\" />Who breaks a butterfly on a wheel?</strong></p>\r\n<p style=\"text-align: justify;\">Hamza Kashgari Mohammad Najeeb is a poet in his mid-twenties. He was a columnist for al-Bilad newspaper until early 2012 when he expressed some concerns about the tenets of his inherited religion as part of a wish for more freedom of expression in his native country.</p>\r\n<p style=\"text-align: justify;\">Mr Najeeb is a Saudi national but according to some of his fellow citizens not of pure enough blood because of his Turkmen family background. A Saudi cleric urged that he be tried for apostasy and a Facebook group of some 26,000 called for his execution.</p>\r\n<p style=\"text-align: justify;\">A smaller group begged that all charges be dropped. In the event, Mr Najeeb was deported to Saudi Arabia by Malaysia while en route to New Zealand where he had hopes of being granted political asylum. He was jailed for almost two years for “denigrating religious beliefs.”</p>\r\n\r\n<blockquote>\r\n<h3 style=\"text-align: justify;\">“Mornings of hope... souls that live and never die. Thanks to God.”</h3>\r\n<p style=\"text-align: right;\"><strong>(Tweet from Hamza Najeeb upon his release from jail in Saudi Arabia 10/29/2013)</strong></p>\r\n</blockquote>\r\n<p style=\"text-align: justify;\">Referring to that call for execution, the Grand Mufti of Egypt said, “We don’t kill our sons. We talk to them.” Ali Gomaa’s first concern was to find out the precise wording of Mr Najeeb’s statements in order to determine if their significance: Was this a mere misconduct, an expression of doubt or even an insult?</p>\r\n<p style=\"text-align: justify;\">It was indeed relevant that the young man had made an apology. The Association of British Muslims went further by saying that, “a state penalty for supposed blasphemy runs counter to the spirit of Islam. No one should suffer for expressing their opinions.” Islam is a religion of love, tolerance and peace. These are indisputable facts.</p>\r\n<p style=\"text-align: justify;\">Could it be that Najeeb’s support of Arab Spring was germane to the prosecution and imprisonment of this young man? Perhaps his criticism of the Saudi Religious Police – aka the Committee for the Promotion of Virtue and the Prevention of Vice – had something to do with all this.</p>\r\n<p style=\"text-align: justify;\">Hamza Kashgari Mohammad Najeeb is a perhaps reluctant hero. He deserves praise for expressing honest doubt about both religious and secular affairs and thinking out loud about possible solutions and answers. He did so at great personal risk running afoul of stern dogmatists who sadly fail to realise that most people, even the devoutly religious, have a habit of using thought processes to analyse their surroundings and find answers that aim to make the world a better place.</p>\r\n<p style=\"text-align: justify;\"><img class=\"aligncenter size-full wp-image-7767\" src=\"https://cfi.co/wp-content/uploads/2014/08/hn2.jpg\" alt=\"hn2\" width=\"496\" height=\"343\" /></p>\r\n<p style=\"text-align: justify;\">As to the dogmatists, more often than not, their vain and misguided attempts to protect religion from detractors but serves to foment further dissent. Faith is by its very nature a liberating experience. Theologians of whatever religion who do not grasp this simple universal concept should probably find a more fitting line of work.</p>",
    "content_text": "Who breaks a butterfly on a wheel?\n\nHamza Kashgari Mohammad Najeeb is a poet in his mid-twenties. He was a columnist for al-Bilad newspaper until early 2012 when he expressed some concerns about the tenets of his inherited religion as part of a wish for more freedom of expression in his native country.\n\nMr Najeeb is a Saudi national but according to some of his fellow citizens not of pure enough blood because of his Turkmen family background. A Saudi cleric urged that he be tried for apostasy and a Facebook group of some 26,000 called for his execution.\n\nA smaller group begged that all charges be dropped. In the event, Mr Najeeb was deported to Saudi Arabia by Malaysia while en route to New Zealand where he had hopes of being granted political asylum. He was jailed for almost two years for “denigrating religious beliefs.”\n\n“Mornings of hope... souls that live and never die. Thanks to God.”\n\n(Tweet from Hamza Najeeb upon his release from jail in Saudi Arabia 10/29/2013)\n\nReferring to that call for execution, the Grand Mufti of Egypt said, “We don’t kill our sons. We talk to them.” Ali Gomaa’s first concern was to find out the precise wording of Mr Najeeb’s statements in order to determine if their significance: Was this a mere misconduct, an expression of doubt or even an insult?\n\nIt was indeed relevant that the young man had made an apology. The Association of British Muslims went further by saying that, “a state penalty for supposed blasphemy runs counter to the spirit of Islam. No one should suffer for expressing their opinions.” Islam is a religion of love, tolerance and peace. These are indisputable facts.\n\nCould it be that Najeeb’s support of Arab Spring was germane to the prosecution and imprisonment of this young man? Perhaps his criticism of the Saudi Religious Police – aka the Committee for the Promotion of Virtue and the Prevention of Vice – had something to do with all this.\n\nHamza Kashgari Mohammad Najeeb is a perhaps reluctant hero. He deserves praise for expressing honest doubt about both religious and secular affairs and thinking out loud about possible solutions and answers. He did so at great personal risk running afoul of stern dogmatists who sadly fail to realise that most people, even the devoutly religious, have a habit of using thought processes to analyse their surroundings and find answers that aim to make the world a better place.\n\nAs to the dogmatists, more often than not, their vain and misguided attempts to protect religion from detractors but serves to foment further dissent. Faith is by its very nature a liberating experience. Theologians of whatever religion who do not grasp this simple universal concept should probably find a more fitting line of work.",
    "content_sha256": "5f070243e8bb54f149b3473adf7cbb4b1e619979c3ed4c1db67c99b020108cb6",
    "record_sha256": "8a8cf06700e977075c399a2df00ad98c20eec3bc3a1567f96a1da77e0c9ba748"
}
