{
    "id": 26142,
    "title": "When Environmental Considerations Are a Driving Force, Banking Needs a Keen Eye — and Unfailing Dedication",
    "slug": "when-environmental-considerations-are-a-driving-force-banking-needs-a-keen-eye-and-unfailing-dedication",
    "url": "https://cfi.co/banking/2023/10/andras-puskas-deputy-ceo-and-cso-mbh-bank/",
    "author": "CFI.co Editorial",
    "published": "2023-10-11 08:58:04",
    "published_gmt": "2023-10-11 07:58:04",
    "modified_gmt": "2023-10-12 10:23:50",
    "categories": [
        "Banking",
        "Banking &amp; Finance",
        "Europe"
    ],
    "classification": {
        "content_class": "editorial_analysis",
        "editorial_lens": "constructive_positive_lens",
        "independence_status": "commercially_supported",
        "independence_basis": "retrospective_review_2026-08",
        "sponsor_disclosure": "none",
        "sponsor_name": "",
        "article_status": "published",
        "historical_status": "current_at_publication",
        "correction_status": "revised",
        "archive_policy": "no_delete",
        "provenance_layer": "github_versioned",
        "wayback_status": "archived",
        "wayback_first_snapshot": "20231030223810",
        "wayback_snapshot_url": "http://web.archive.org/web/20231030223810/https://cfi.co/banking/2023/10/andras-puskas-deputy-ceo-and-cso-mbh-bank/",
        "license": "CFI-OAAL-1.0",
        "correction_class": "label_regime_change"
    },
    "excerpt": "",
    "content_html": "<h2><em>MBH Bank and its risk assessor have taken that message to heart.</em></h2>\r\n<p style=\"text-align: justify;\">MBH Bank management firmly believes it has a responsibility towards sustainability — as a financial institution, in lending and investment practices, and in day-to-day operations. It has taken great strides, under the watchful eye of deputy CEO and CSO, András Puskás. As the deputy CEO for municipal services, churches, ESG and <a href=\"https://cfi.co/category/sustainability/\">sustainability</a>, communications, and government relations at MBH Bank, he has a full plate.</p>\r\n\r\n\r\n[caption id=\"attachment_26143\" align=\"alignright\" width=\"500\"]<img class=\"size-full wp-image-26143\" src=\"https://cfi.co/wp-content/uploads/2023/10/MBHBank_Andras_Puskas-jpg.webp\" alt=\"Andras Puskas, MBH Bank\" width=\"500\" height=\"701\" /> <strong>Deputy CEO and Head of Risk-assessment:</strong> András Puskás[/caption]\r\n<p style=\"text-align: justify;\">One of the bank’s main goals is to be the market leader in sustainable finance — and it nailed its colours to the mast when it established a dedicated ESG and sustainability division last year. The bank has embedded ESG assessment into the entire loan-approval process.</p>\r\n<p style=\"text-align: justify;\">“I am often asked what I think is most challenging on that path,” says Puskás. “It’s probably the management of the immense amount of data that is necessary for all the disclosures we have on our hands.</p>\r\n<p style=\"text-align: justify;\">“That’s why one of our key projects — which MBH Bank has just launched — is to create a company-wide data pool that will enable us to meet these obligations more easily, and at the same time provide our own top management with better-quality data for decision-making.”</p>\r\n<p style=\"text-align: justify;\">In practice, this means that <a href=\"https://cfi.co/banking/2023/10/mbh-bank-future-prosperity-and-a-healthy-planet/\">MBH Bank</a> will assess ESG risks for most loan transactions, providing a complete picture of sustainability risks over a three-year horizon.</p>\r\n<p style=\"text-align: justify;\">Puskás is an old hand in this field. He graduated from the <a href=\"https://www.uni-corvinus.hu/?lang=en\" target=\"_blank\" rel=\"noopener\">Budapest University of Economics and Public Administration</a> with a degree in economics in 2000. He worked for the Ministry of Finance as chief of cabinet in the Cabinet of Ministers.</p>\r\n<p style=\"text-align: justify;\">He then served as deputy mayor of the City of Budapest, where he was responsible for urban development. Since 2014, he has worked as deputy CEO and member of the board of directors of the Hungarian Export-Import Bank and the Hungarian Exporthitel Biztosító.</p>\r\n<p style=\"text-align: justify;\">He was deputy CEO for risk and operations at Budapest Bank, and a member of the bank's senior management and board of directors since 2018. He headed risk management, operations, IT and the project-management office (PMO).</p>\r\n<p style=\"text-align: justify;\">“I came across this quote from Alan Kay which says, ‘The best way to predict the future is to create it’,” András Puskás says. “I think it fits well in this context. In that spirit, to create the future we aspire to, we will continue to invest in our people — in their skills, training, and development.”</p>\r\n<p style=\"text-align: justify;\">There would also be investment in clients and customers, he said, via product- and service development and innovation. “And, of course, in Nature and the planet, through our biodiversity initiative, which will soon be launched.” His general advice is a rallying and optimistic cry: “Let's all continue to invest in the future.”</p>",
    "content_text": "MBH Bank and its risk assessor have taken that message to heart.\n\nMBH Bank management firmly believes it has a responsibility towards sustainability — as a financial institution, in lending and investment practices, and in day-to-day operations. It has taken great strides, under the watchful eye of deputy CEO and CSO, András Puskás. As the deputy CEO for municipal services, churches, ESG and sustainability, communications, and government relations at MBH Bank, he has a full plate.\n\n[caption id=\"attachment_26143\" align=\"alignright\" width=\"500\"] Deputy CEO and Head of Risk-assessment: András Puskás[/caption]\nOne of the bank’s main goals is to be the market leader in sustainable finance — and it nailed its colours to the mast when it established a dedicated ESG and sustainability division last year. The bank has embedded ESG assessment into the entire loan-approval process.\n\n“I am often asked what I think is most challenging on that path,” says Puskás. “It’s probably the management of the immense amount of data that is necessary for all the disclosures we have on our hands.\n\n“That’s why one of our key projects — which MBH Bank has just launched — is to create a company-wide data pool that will enable us to meet these obligations more easily, and at the same time provide our own top management with better-quality data for decision-making.”\n\nIn practice, this means that MBH Bank will assess ESG risks for most loan transactions, providing a complete picture of sustainability risks over a three-year horizon.\n\nPuskás is an old hand in this field. He graduated from the Budapest University of Economics and Public Administration with a degree in economics in 2000. He worked for the Ministry of Finance as chief of cabinet in the Cabinet of Ministers.\n\nHe then served as deputy mayor of the City of Budapest, where he was responsible for urban development. Since 2014, he has worked as deputy CEO and member of the board of directors of the Hungarian Export-Import Bank and the Hungarian Exporthitel Biztosító.\n\nHe was deputy CEO for risk and operations at Budapest Bank, and a member of the bank's senior management and board of directors since 2018. He headed risk management, operations, IT and the project-management office (PMO).\n\n“I came across this quote from Alan Kay which says, ‘The best way to predict the future is to create it’,” András Puskás says. “I think it fits well in this context. In that spirit, to create the future we aspire to, we will continue to invest in our people — in their skills, training, and development.”\n\nThere would also be investment in clients and customers, he said, via product- and service development and innovation. “And, of course, in Nature and the planet, through our biodiversity initiative, which will soon be launched.” His general advice is a rallying and optimistic cry: “Let's all continue to invest in the future.”",
    "content_sha256": "cb80a57d625456a1652f944df38a2fdd4c0d1e56dda7f7fafd2f22f5ba5714ea",
    "record_sha256": "9254d3206b613942aab2fab85c0fc549a1e76585b55aa215199c67fad04b5105"
}
