{
    "id": 15477,
    "title": "A Question of Balance Finds Fine Solution with Fiduciaria Central",
    "slug": "a-question-of-balance-finds-fine-solution-with-fiduciaria-central",
    "url": "https://cfi.co/latinamerica/2020/05/a-question-of-balance-finds-fine-solution-with-fiduciaria-central/",
    "author": "CFI.co Editorial",
    "published": "2020-05-28 10:24:51",
    "published_gmt": "2020-05-28 09:24:51",
    "modified_gmt": "2022-10-20 10:28:26",
    "categories": [
        "Latin America"
    ],
    "classification": {
        "content_class": "editorial_analysis",
        "editorial_lens": "constructive_positive_lens",
        "independence_status": "commercially_supported",
        "independence_basis": "retrospective_review_2026-08",
        "sponsor_disclosure": "none",
        "sponsor_name": "",
        "article_status": "published",
        "historical_status": "current_at_publication",
        "correction_status": "revised",
        "archive_policy": "no_delete",
        "provenance_layer": "github_versioned",
        "wayback_status": "archived",
        "wayback_first_snapshot": "20200922171107",
        "wayback_snapshot_url": "http://web.archive.org/web/20200922171107/https://cfi.co/latinamerica/2020/05/a-question-of-balance-finds-fine-solution-with-fiduciaria-central/",
        "license": "CFI-OAAL-1.0",
        "correction_class": "label_regime_change"
    },
    "excerpt": "",
    "content_html": "[caption id=\"attachment_15478\" align=\"aligncenter\" width=\"851\"]<img class=\"size-full wp-image-15478\" src=\"https://cfi.co/wp-content/uploads/2020/05/President-Oscar-de-Jesus-Marin.jpg\" alt=\"President: Oscar de Jesús Marín\" width=\"851\" height=\"494\" /> <strong>President:</strong> Oscar de Jesús Marín[/caption]\r\n<p style=\"text-align: justify;\"><strong>From its headquarters in Bogota and Medellin, Fiduciaria Central works to build trust and reach the goals of its clients — Colombian nationals and foreign investors — always with the intent to stimulate the socio-economic development of Colombia.</strong></p>\r\n<p style=\"text-align: justify;\">Fiduciaria Central is a subsidiary of IDEA (Institute for the Development of Antioquia) and was founded in 1992; its corporate purpose is the celebration and execution of contracts and operations of the fiduciary activity, subject to the restricted requirements and limitations imposed by the Colombian laws, all of those contained in the Organic Statute of the Financial System, the Colombian Commercial Code and the External Circulars issued by the Financial Superintendence of Colombia.</p>\r\n<p style=\"text-align: justify;\">Its position in the sector makes it a crucial partner for projects that cover a range of sectors. Starting with hotel tourism and real estate of all types, including VIS, VIP, VIPA, from strata 3 to 6 throughout the national territory; as well as some commercial enterprises and reaches departments and municipalities that no other company does, helping them to unite each other behind the cause of corporate social responsibility.</p>\r\n<p style=\"text-align: justify;\">Fiduciaria has developed a portfolio of products and services that covers management of investment funds, business administration and payments, legal representation of bondholders and administration of pension liabilities. The main objective of Fiduciaria Central is to serve as a financial facilitator between companies and businesses, helping to \"untie knots in the economic process\", fact that helped the fiduciary to consolidate as a financially stable entity and allows it to project itself in the future as the fiduciary with the greater participation in regional and national development.</p>\r\n<p style=\"text-align: justify;\">The company was acquired at the beginning of the 21st Century by the IDEA, led by the current Fiduciaria Central president, Oscar de Jesús Marín, who was then serving as IDEA manager at the time and returned to the fiduciary in 2016, seeking to promote the consolidation of the company, its positioning in the market and its participation and performance at national level. Marín had accumulated extensive experience in his political career prior to his Fiduciaria appointment, which has allowed him to understand the importance of service and leadership. Those values continue to permeate the corporate culture of the fiduciary, inspiring team members to strive for shared business objectives.</p>\r\n<p style=\"text-align: justify;\">Fiduciaria Central has developed several high impact projects that have boosted national economic growth and strengthened national infrastructure. Marín has demonstrated exemplary leadership as a president, taking on the task of applying financial inclusion strategies that have helped lower-income families become homeowners, and have generated jobs for indigenous communities. The residents of remote areas of Colombia are both the native labour force and the beneficiaries of the fiduciary’s business developments. It works both ways, meaning that Fiduciaria Central recognises the company would not exist without the goodwill of the people. It cares about the welfare of employees and their families and accepts responsibility for all regulatory compliance with government authorities. With these pillars, it builds support systems for local communities.</p>\r\n<p style=\"text-align: justify;\">Good corporate governance is evident in all Fiduciaria Central’s operations, balancing the need for corporate transparency and respect for customers with the confidentiality of their information. Under Marín’s leadership, Fiduciaria Central has reached one of the most important accomplishments for finantial entities, garnering an AAA credit rating for the efficient management of its portfolio in the 2019 term.</p>",
    "content_text": "[caption id=\"attachment_15478\" align=\"aligncenter\" width=\"851\"] President: Oscar de Jesús Marín[/caption]\nFrom its headquarters in Bogota and Medellin, Fiduciaria Central works to build trust and reach the goals of its clients — Colombian nationals and foreign investors — always with the intent to stimulate the socio-economic development of Colombia.\n\nFiduciaria Central is a subsidiary of IDEA (Institute for the Development of Antioquia) and was founded in 1992; its corporate purpose is the celebration and execution of contracts and operations of the fiduciary activity, subject to the restricted requirements and limitations imposed by the Colombian laws, all of those contained in the Organic Statute of the Financial System, the Colombian Commercial Code and the External Circulars issued by the Financial Superintendence of Colombia.\n\nIts position in the sector makes it a crucial partner for projects that cover a range of sectors. Starting with hotel tourism and real estate of all types, including VIS, VIP, VIPA, from strata 3 to 6 throughout the national territory; as well as some commercial enterprises and reaches departments and municipalities that no other company does, helping them to unite each other behind the cause of corporate social responsibility.\n\nFiduciaria has developed a portfolio of products and services that covers management of investment funds, business administration and payments, legal representation of bondholders and administration of pension liabilities. The main objective of Fiduciaria Central is to serve as a financial facilitator between companies and businesses, helping to \"untie knots in the economic process\", fact that helped the fiduciary to consolidate as a financially stable entity and allows it to project itself in the future as the fiduciary with the greater participation in regional and national development.\n\nThe company was acquired at the beginning of the 21st Century by the IDEA, led by the current Fiduciaria Central president, Oscar de Jesús Marín, who was then serving as IDEA manager at the time and returned to the fiduciary in 2016, seeking to promote the consolidation of the company, its positioning in the market and its participation and performance at national level. Marín had accumulated extensive experience in his political career prior to his Fiduciaria appointment, which has allowed him to understand the importance of service and leadership. Those values continue to permeate the corporate culture of the fiduciary, inspiring team members to strive for shared business objectives.\n\nFiduciaria Central has developed several high impact projects that have boosted national economic growth and strengthened national infrastructure. Marín has demonstrated exemplary leadership as a president, taking on the task of applying financial inclusion strategies that have helped lower-income families become homeowners, and have generated jobs for indigenous communities. The residents of remote areas of Colombia are both the native labour force and the beneficiaries of the fiduciary’s business developments. It works both ways, meaning that Fiduciaria Central recognises the company would not exist without the goodwill of the people. It cares about the welfare of employees and their families and accepts responsibility for all regulatory compliance with government authorities. With these pillars, it builds support systems for local communities.\n\nGood corporate governance is evident in all Fiduciaria Central’s operations, balancing the need for corporate transparency and respect for customers with the confidentiality of their information. Under Marín’s leadership, Fiduciaria Central has reached one of the most important accomplishments for finantial entities, garnering an AAA credit rating for the efficient management of its portfolio in the 2019 term.",
    "content_sha256": "a26fa45211b655252c9f541792d233b168d871e8912309c5b47508567ae16ade",
    "record_sha256": "ae931133b3bc45ec36e31aaece8557b853da15b3ff62dcb35163c090cf1dbde1"
}
