{
    "id": 26854,
    "title": "There’s More to Britain than London: Focus on Regions, Advises Think-Tank",
    "slug": "theres-more-to-britain-than-london-focus-on-regions-advises-think-tank",
    "url": "https://cfi.co/brave-new-world/2024/06/theres-more-to-britain-than-london-focus-on-regions-advises-think-tank/",
    "author": "CFI.co Editorial",
    "published": "2024-06-12 14:09:40",
    "published_gmt": "2024-06-12 13:09:40",
    "modified_gmt": "2024-06-12 13:09:40",
    "categories": [
        "Brave New World",
        "Europe"
    ],
    "classification": {
        "content_class": "editorial_analysis",
        "editorial_lens": "constructive_positive_lens",
        "independence_status": "independent_editorial",
        "independence_basis": "retrospective_review_2026-08",
        "sponsor_disclosure": "none",
        "sponsor_name": "",
        "article_status": "published",
        "historical_status": "current_at_publication",
        "correction_status": "none",
        "archive_policy": "no_delete",
        "provenance_layer": "github_versioned",
        "wayback_status": "archived",
        "wayback_first_snapshot": "20240613224022",
        "wayback_snapshot_url": "http://web.archive.org/web/20240613224022/https://cfi.co/brave-new-world/2024/06/theres-more-to-britain-than-london-focus-on-regions-advises-think-tank/",
        "license": "CFI-OAAL-1.0"
    },
    "excerpt": "",
    "content_html": "<p style=\"text-align: justify;\"><em>Low investment in the UK’s regional cities is hindering economic growth and the country’s G7 status, report warns. </em></p>\r\n<p style=\"text-align: justify;\"><strong>A lack of investment in regional British cities has hampered economic growth, resulting in lower living standards than in the US, France, or Germany.</strong></p>\r\n<img class=\"aligncenter size-large wp-image-26855\" src=\"https://cfi.co/wp-content/uploads/2024/06/London-1024x594.webp\" alt=\"London\" width=\"900\" height=\"522\" />\r\n<p style=\"text-align: justify;\">That’s according to a report released ahead of the 50th G7 summit in Fasano, southern Italy. The Centre of Cities think-tank found that the primary difference between the UK and its peers was low productivity in cities such as Manchester, Birmingham, Glasgow, Sheffield and Nottingham.</p>\r\n<p style=\"text-align: justify;\">Cities of a similar size outside Paris and Berlin fare far better when measured by output per worker, per hour. Investment is more evenly distributed across the US, too, where cities thrive thanks to targeted financial support and initiatives.</p>\r\n<p style=\"text-align: justify;\">Lyon and Frankfurt rank higher than Birmingham and Manchester by these metrics , affecting the UK's standing among G7 economies. Britain remains a “middle-ranking” country — but is still ahead of Canada, Italy, and Japan in terms of output per hour.</p>\r\n\r\n<h3 style=\"text-align: justify;\"><strong>Reaching the Summit</strong></h3>\r\n<p style=\"text-align: justify;\">The pre-G7 report said London is “no longer consistent” in terms of source-of-income and wealth for the rest of the country — increasing the vulnerability of regional areas. The British government has been urged to adopt a broader investment strategy to improve digital strengths.</p>\r\n<p style=\"text-align: justify;\">Laura Lodwick, chief of hub operations for development organisation AND Digital said regional investment was vital for national economic prosperity. “Technology, in particular, can open up new opportunities to help distribute wealth and help local communities to thrive,” she said. “A major contributor to the regional gap is that many digitally skilled people move away from their local communities to London to pursue a career. The incoming government, local councils, and regional businesses need a strategy to retain talent.\"</p>\r\n<p style=\"text-align: justify;\">Digital skills in burgeoning areas such as generative AI play a crucial role in empowerment of citizens, says Lodwick. “Education and local training are important to reskill and upskill the regions. Skills training should form part of retention strategies for local businesses, offering constant opportunities that lead towards career progression.</p>\r\n<p style=\"text-align: justify;\">\"Technology has no boundaries, it's not just restricted to London. It's time to show off what the rest of the UK has to offer.\"</p>",
    "content_text": "Low investment in the UK’s regional cities is hindering economic growth and the country’s G7 status, report warns.\n\nA lack of investment in regional British cities has hampered economic growth, resulting in lower living standards than in the US, France, or Germany.\n\nThat’s according to a report released ahead of the 50th G7 summit in Fasano, southern Italy. The Centre of Cities think-tank found that the primary difference between the UK and its peers was low productivity in cities such as Manchester, Birmingham, Glasgow, Sheffield and Nottingham.\n\nCities of a similar size outside Paris and Berlin fare far better when measured by output per worker, per hour. Investment is more evenly distributed across the US, too, where cities thrive thanks to targeted financial support and initiatives.\n\nLyon and Frankfurt rank higher than Birmingham and Manchester by these metrics , affecting the UK's standing among G7 economies. Britain remains a “middle-ranking” country — but is still ahead of Canada, Italy, and Japan in terms of output per hour.\n\nReaching the Summit\n\nThe pre-G7 report said London is “no longer consistent” in terms of source-of-income and wealth for the rest of the country — increasing the vulnerability of regional areas. The British government has been urged to adopt a broader investment strategy to improve digital strengths.\n\nLaura Lodwick, chief of hub operations for development organisation AND Digital said regional investment was vital for national economic prosperity. “Technology, in particular, can open up new opportunities to help distribute wealth and help local communities to thrive,” she said. “A major contributor to the regional gap is that many digitally skilled people move away from their local communities to London to pursue a career. The incoming government, local councils, and regional businesses need a strategy to retain talent.\"\n\nDigital skills in burgeoning areas such as generative AI play a crucial role in empowerment of citizens, says Lodwick. “Education and local training are important to reskill and upskill the regions. Skills training should form part of retention strategies for local businesses, offering constant opportunities that lead towards career progression.\n\n\"Technology has no boundaries, it's not just restricted to London. It's time to show off what the rest of the UK has to offer.\"",
    "content_sha256": "16768a2e1d868a4aaf72912420d476dd49dd90a8b44bd618f9d8b418a497f86b",
    "record_sha256": "5c7ec581d66d1707b21e344d95b3d6f6f352c371f86f90b12953f12f05129ff9"
}
