{
    "id": 3482,
    "title": "UN: Education and Youth Unemployment Issues Must be Addressed Now",
    "slug": "un-education-and-youth-unemployment-issues-must-be-addressed-now",
    "url": "https://cfi.co/sustainability/2013/04/un-education-and-youth-unemployment-issues-must-be-addressed-now/",
    "author": "CFI.co Editorial",
    "published": "2013-04-02 09:15:56",
    "published_gmt": "2013-04-02 08:15:56",
    "modified_gmt": "2022-08-03 16:11:50",
    "categories": [
        "Sustainability"
    ],
    "classification": {
        "content_class": "editorial_analysis",
        "editorial_lens": "constructive_positive_lens",
        "independence_status": "independent_editorial",
        "independence_basis": "retrospective_review_2026-08",
        "sponsor_disclosure": "none",
        "sponsor_name": "",
        "article_status": "published",
        "historical_status": "current_at_publication",
        "correction_status": "none",
        "archive_policy": "no_delete",
        "provenance_layer": "github_versioned",
        "wayback_status": "archived",
        "wayback_first_snapshot": "20190823045600",
        "wayback_snapshot_url": "http://web.archive.org/web/20190823045600/https://cfi.co/sustainability/2013/04/un-education-and-youth-unemployment-issues-must-be-addressed-now/",
        "license": "CFI-OAAL-1.0"
    },
    "excerpt": "",
    "content_html": "[caption id=\"attachment_3484\" align=\"alignright\" width=\"232\"]<img class=\"size-full wp-image-3484\" alt=\"Ban Ki-moon\" src=\"https://cfi.co/wp-content/uploads/2013/04/Ban-Ki-moon.jpg\" width=\"232\" height=\"173\" /> <strong>Ban Ki-moon, UN Secretary-General</strong>[/caption]\r\n<p style=\"text-align: justify;\"><strong>The process of establishing a post-2015 development agenda must include youth input and participation to reflect the issues that concern them, UN Secretary-General Ban Ki-moon’s Envoy on Youth stressed in late March.</strong></p>\r\n<p style=\"text-align: justify;\">“We are at a crossroads. With 1,000 days left to meet the Millennium Development Goals (MDGs), we are discussing and trying to set the new priorities for the post-2015 development agenda,” said Ahmad Alhendawi, referring to the eight anti-poverty targets with specific objectives on poverty alleviation, education, gender equality, child and maternal health, environmental stability, HIV/AIDS reduction, and a ‘Global Partnership for Development.’</p>\r\n<p style=\"text-align: justify;\">“This is definitely an opportunity where young people can participate in setting the agenda, and then own this agenda by being equal partners in its implementation and evaluation,” he told reporters in New York via satellite from Dakar, Senegal, where he is attending the World Education Forum.</p>\r\n<p style=\"text-align: justify;\">Mr. Alhendawi stressed that with 1.2 billion young people globally – the largest ever population of young people – issues such as education and unemployment need to be addressed by policymakers.</p>\r\n\r\n<blockquote>\r\n<h3 style=\"text-align: justify;\">“Youth unemployment figures are daunting,” he said. “Some 425 million jobs need to be created in the next 15 years, and the situation so far is not promising.”</h3>\r\n</blockquote>\r\n<p style=\"text-align: justify;\">Mr. Alhendawi said that during his mandate he would not only work with different UN agencies to enhance their programmes on youth, but he would also be a messenger between the world body and young people and would promote the creation of structured mechanisms for youth participation at a national, regional and international level.</p>\r\n<p style=\"text-align: justify;\">“This is a two-way communication,” he said. “This includes carrying the voices and messages of young people back to the Organization and opening channels of communication between youth and the United Nations.”</p>\r\n<p style=\"text-align: justify;\">He added that he would also work with marginalized youth, including women and girls, to involve them in development processes, and give them access to information, as well as advocate for a stronger, youth-friendly development agenda.</p>",
    "content_text": "[caption id=\"attachment_3484\" align=\"alignright\" width=\"232\"] Ban Ki-moon, UN Secretary-General[/caption]\nThe process of establishing a post-2015 development agenda must include youth input and participation to reflect the issues that concern them, UN Secretary-General Ban Ki-moon’s Envoy on Youth stressed in late March.\n\n“We are at a crossroads. With 1,000 days left to meet the Millennium Development Goals (MDGs), we are discussing and trying to set the new priorities for the post-2015 development agenda,” said Ahmad Alhendawi, referring to the eight anti-poverty targets with specific objectives on poverty alleviation, education, gender equality, child and maternal health, environmental stability, HIV/AIDS reduction, and a ‘Global Partnership for Development.’\n\n“This is definitely an opportunity where young people can participate in setting the agenda, and then own this agenda by being equal partners in its implementation and evaluation,” he told reporters in New York via satellite from Dakar, Senegal, where he is attending the World Education Forum.\n\nMr. Alhendawi stressed that with 1.2 billion young people globally – the largest ever population of young people – issues such as education and unemployment need to be addressed by policymakers.\n\n“Youth unemployment figures are daunting,” he said. “Some 425 million jobs need to be created in the next 15 years, and the situation so far is not promising.”\n\nMr. Alhendawi said that during his mandate he would not only work with different UN agencies to enhance their programmes on youth, but he would also be a messenger between the world body and young people and would promote the creation of structured mechanisms for youth participation at a national, regional and international level.\n\n“This is a two-way communication,” he said. “This includes carrying the voices and messages of young people back to the Organization and opening channels of communication between youth and the United Nations.”\n\nHe added that he would also work with marginalized youth, including women and girls, to involve them in development processes, and give them access to information, as well as advocate for a stronger, youth-friendly development agenda.",
    "content_sha256": "d0bdd32adaa8ca7287a0d76def27a11580fdd28d1b4fc40ad1070a7ddc3b5018",
    "record_sha256": "a89032173b1f0aeec6c3e4a3f943ba0ff497eefc21bbc76fa73bfacf756509ef"
}
