{
    "id": 3404,
    "title": "The Queen of Jordan: More Than an Ornament",
    "slug": "the-queen-of-jordan-more-than-an-ornament",
    "url": "https://cfi.co/editors-picks/2013/03/the-queen-of-jordan-more-than-an-ornament/",
    "author": "CFI.co Editorial",
    "published": "2013-03-26 13:05:37",
    "published_gmt": "2013-03-26 13:05:37",
    "modified_gmt": "2022-10-14 10:27:54",
    "categories": [],
    "classification": {
        "content_class": "editorial_analysis",
        "editorial_lens": "constructive_positive_lens",
        "independence_status": "independent_editorial",
        "independence_basis": "retrospective_review_2026-08",
        "sponsor_disclosure": "none",
        "sponsor_name": "",
        "article_status": "published",
        "historical_status": "current_at_publication",
        "correction_status": "none",
        "archive_policy": "no_delete",
        "provenance_layer": "github_versioned",
        "wayback_status": "archived",
        "wayback_first_snapshot": "20140827161432",
        "wayback_snapshot_url": "http://web.archive.org/web/20140827161432/http://cfi.co/editors-picks/2013/03/the-queen-of-jordan-more-than-an-ornament/",
        "license": "CFI-OAAL-1.0"
    },
    "excerpt": "",
    "content_html": "[caption id=\"attachment_3405\" align=\"alignright\" width=\"300\"]<img class=\" wp-image-3405 size-medium\" src=\"https://cfi.co/wp-content/uploads/2013/03/rania-300x258.jpg\" alt=\"\" width=\"300\" height=\"258\" /> Rania Al Abdullah, Queen of Jordan[/caption]\r\n<p style=\"text-align: justify;\"><strong>Born in 1970 in Kuwait to Palestinian parents, Rania, wife of King Abdullah II has been his Queen since 1999. Her concerns at home include environmental matters, health, education, youth and human rights.  She looks to ‘Righting the wrongs of the country and helping the people have better lives’. Much more than a royal ornament, Rania has made a good stand against terrorism and spoke eloquently after the bombings in Amman.</strong></p>\r\n<p style=\"text-align: justify;\">Her first venture was the establishment of the Jordan River Foundation (1995), an NGO which places the welfare of children above political considerations and social taboos. In 2002, Queen Rania was appointed as a member of the World Economic Forum’s Foundation Board, became a member of the UN Foundation Board of Governors four years later and Chair of the UN Girls Education Initiative in 2009. She is UNICEF’s advocate for children.</p>\r\n\r\n<blockquote>\r\n<h3 style=\"text-align: justify;\">\"She looks to ‘Righting the wrongs of the country and helping the people have better lives’.\"</h3>\r\n</blockquote>\r\n<p style=\"text-align: justify;\">After receiving a Business Administration Degree, Rania took up posts in Amman at Citibank and Apple. She is a respected author who writes mainly for children and in May 2010 topped the New York Times Best Seller List (Children’s Books).</p>",
    "content_text": "[caption id=\"attachment_3405\" align=\"alignright\" width=\"300\"] Rania Al Abdullah, Queen of Jordan[/caption]\nBorn in 1970 in Kuwait to Palestinian parents, Rania, wife of King Abdullah II has been his Queen since 1999. Her concerns at home include environmental matters, health, education, youth and human rights. She looks to ‘Righting the wrongs of the country and helping the people have better lives’. Much more than a royal ornament, Rania has made a good stand against terrorism and spoke eloquently after the bombings in Amman.\n\nHer first venture was the establishment of the Jordan River Foundation (1995), an NGO which places the welfare of children above political considerations and social taboos. In 2002, Queen Rania was appointed as a member of the World Economic Forum’s Foundation Board, became a member of the UN Foundation Board of Governors four years later and Chair of the UN Girls Education Initiative in 2009. She is UNICEF’s advocate for children.\n\n\"She looks to ‘Righting the wrongs of the country and helping the people have better lives’.\"\n\nAfter receiving a Business Administration Degree, Rania took up posts in Amman at Citibank and Apple. She is a respected author who writes mainly for children and in May 2010 topped the New York Times Best Seller List (Children’s Books).",
    "content_sha256": "b4fc631cdbee76ea6c5f9a4661183b8b2c3f4de2a49c365295e8e1b9709126f0",
    "record_sha256": "648917cee6f75cbefc1fee4b74ee9c55a68e19ab3c0c51fb28b3aa4b05eb6a36"
}
