{
    "id": 3512,
    "title": "Michelle Obama: A Debt of Gratitude",
    "slug": "michelle-obama-a-debt-of-gratitude",
    "url": "https://cfi.co/northamerica/2013/04/michelle-obama-a-debt-of-gratitude/",
    "author": "CFI.co Editorial",
    "published": "2013-04-03 13:31:29",
    "published_gmt": "2013-04-03 13:31:29",
    "modified_gmt": "2013-04-03 13:32:52",
    "categories": [
        "North America"
    ],
    "classification": {
        "content_class": "editorial_analysis",
        "editorial_lens": "constructive_positive_lens",
        "independence_status": "independent_editorial",
        "independence_basis": "retrospective_review_2026-08",
        "sponsor_disclosure": "none",
        "sponsor_name": "",
        "article_status": "published",
        "historical_status": "current_at_publication",
        "correction_status": "none",
        "archive_policy": "no_delete",
        "provenance_layer": "github_versioned",
        "wayback_status": "archived",
        "wayback_first_snapshot": "20190823045725",
        "wayback_snapshot_url": "http://web.archive.org/web/20190823045725/https://cfi.co/northamerica/2013/04/michelle-obama-a-debt-of-gratitude/",
        "license": "CFI-OAAL-1.0"
    },
    "excerpt": "",
    "content_html": "<p style=\"text-align: justify;\"><strong><img class=\"alignright  wp-image-3514\" alt=\"mb\" src=\"https://cfi.co/wp-content/uploads/2013/04/mb.jpg\" width=\"215\" height=\"201\" />The 2012 speech by Michelle Obama at the Democratic National Convention in support of her husband was undeniably brilliant and a political tour de force.</strong> She connected with the aspirations of millions of worried voters by recalling the personal stories of the Obamas - which were, of course, in stark contrast to those of the Republican candidate. At least one commentator noted that if Obama were to be re-elected he would have a greater debt of gratitude to his wife than any other president in history. She may also have helped him secure his second term by assuring women voters of his worth.</p>\r\n<p style=\"text-align: justify;\">Michelle Obama studied sociology and African American studies at Princeton University, graduated from Harvard Law School in 1988 and then took up work at a Chicago law firm. Her later appointments have included Assistant Commissioner of Planning &amp; Development at Chicago’s City Hall, Founding Executive Director, Chicago Chapter of Public Allies (which prepares young people for public service) and Associate Dean, Student Services at Chicago University.</p>\r\n\r\n<blockquote>\r\n<h3 style=\"text-align: justify;\">\"At least one commentator noted that if Obama were to be re-elected he would have a greater debt of gratitude to his wife than any other president in history.\"</h3>\r\n</blockquote>\r\n<p style=\"text-align: justify;\">In 2010, the First Lady launched ‘Let’s Move’ a camp to fight childhood obesity and in the following year ‘Joining Forces’ in concert with Dr Jill Biden. ‘Joining Forces’ was established to respond to and support the needs of military personnel and their families.</p>\r\n<p style=\"text-align: justify;\">Since her husband became president, Michelle Obama has demonstrated that she could easily have a prominent political future in her own right and perhaps as part of a double act to rival that of the Clintons. There is no question that she has acceptance, popular appeal and the relevant skills, but is there any inclination on her part?  It would seem unlikely at this point but at one time there was also doubt about Hillary Clinton’s motivation.</p>",
    "content_text": "The 2012 speech by Michelle Obama at the Democratic National Convention in support of her husband was undeniably brilliant and a political tour de force. She connected with the aspirations of millions of worried voters by recalling the personal stories of the Obamas - which were, of course, in stark contrast to those of the Republican candidate. At least one commentator noted that if Obama were to be re-elected he would have a greater debt of gratitude to his wife than any other president in history. She may also have helped him secure his second term by assuring women voters of his worth.\n\nMichelle Obama studied sociology and African American studies at Princeton University, graduated from Harvard Law School in 1988 and then took up work at a Chicago law firm. Her later appointments have included Assistant Commissioner of Planning & Development at Chicago’s City Hall, Founding Executive Director, Chicago Chapter of Public Allies (which prepares young people for public service) and Associate Dean, Student Services at Chicago University.\n\n\"At least one commentator noted that if Obama were to be re-elected he would have a greater debt of gratitude to his wife than any other president in history.\"\n\nIn 2010, the First Lady launched ‘Let’s Move’ a camp to fight childhood obesity and in the following year ‘Joining Forces’ in concert with Dr Jill Biden. ‘Joining Forces’ was established to respond to and support the needs of military personnel and their families.\n\nSince her husband became president, Michelle Obama has demonstrated that she could easily have a prominent political future in her own right and perhaps as part of a double act to rival that of the Clintons. There is no question that she has acceptance, popular appeal and the relevant skills, but is there any inclination on her part? It would seem unlikely at this point but at one time there was also doubt about Hillary Clinton’s motivation.",
    "content_sha256": "d0c921e5a93bda77809f2f08e0aed143eea257c55598ed93679e5ff4773b9dc8",
    "record_sha256": "f56237c72f8dbc30a95f52e4640ea1cc4a85dd2fdb663169bfe885fa505e2da9"
}
